<?xml version="1.0" encoding="UTF-8" ?>

<Companies xmlns:xsi="http://www.w3.org/2001/XMLSchema-instance" xsi:noNamespaceSchemaLocation="Companies.xsd">
  <Company>ABN AMRO Holding</Company>
  <Company>ASML Holding</Company>
  <Company>Heijmans</Company>
  <Company>Heineken</Company>
  <Company>Kon. Ahold</Company>
  <Company>Kon. DSM</Company>
  <Company>Kon. KPN</Company>
  <Company>Kon. Philips Electronics</Company>
  <Company>LogicaCMG</Company>
  <Company>Nutreco</Company>
  <Company>Postbank</Company>
  <Company>Simac</Company>
  <Company>Tiscali</Company>
  <Company>TomTom</Company>
</Companies>
