<?xml version="1.0" encoding="UTF-8" ?>

<Companies xmlns:xsi="http://www.w3.org/2001/XMLSchema-instance" xsi:noNamespaceSchemaLocation="Companies.xsd">
  <Company>ABN AMRO Holding</Company>
  <Company>ASML Holding</Company>
  <Company>Corporate Express</Company>
  <Company>Getronics</Company>
  <Company>Hagemeyer</Company>
  <Company>Heijmans</Company>
  <Company>Heineken</Company>
  <Company>Kon. Ahold</Company>
  <Company>Kon. DSM</Company>
  <Company>Kon. KPN</Company>
  <Company>Kon. Philips Electronics</Company>
  <Company>Libertel</Company>
  <Company>LogicaCMG</Company>
  <Company>Numico</Company>
  <Company>Nutreco</Company>
  <Company>Postbank</Company>
  <Company>Simac</Company>
  <Company>Tele Atlas</Company>
  <Company>Tiscali</Company>
  <Company>TomTom</Company>
  <Company>UPC</Company>
  <Company>Vodafone</Company>
  <Company>World Online</Company>
</Companies>
